title,snippet,link
Placement,"Campus Recruitment. Campus recruitment is a strategy for sourcing, engaging and hiring young talent for internship and entry-level positions.",https://www.nit.ac.in/placement.php
NIT Placements – Know Highest Salary Package & ...,"21 Jan 2025 — The average package of students in top NITs in India usually ranges from Rs 10-15 lakh per annum whereas, for other NITs, it is between Rs 5-10 lakh per annum.",https://www.shiksha.com/engineering/articles/nit-placements-know-highest-salary-package-placement-process-blogId-32207
NIT Durgapur,Placement Rate. ₹80 LPA. Highest Package. 210+. Companies Visited. 44th. NIRF Ranking 2024. TRAINING AND PLACEMENT CELL. NIT Durgapur. The Training & Placement ...,https://placement.nitdgp.ac.in/
Placements,"In 2020-21, 72 UG students were placed with 73.46% placement and a highest package of 43.31 Lacs. In 2019-20, 69 UG students were placed with 70.4% placement ...",https://www.nitt.edu/home/academics/departments/ece/placements
Placement Statistics,"Placement Statistics, Guidelines, Placement Protocol, T&P Cell Guidelines, Placement Policy, Leave Application Form",https://nitkkr.ac.in/placement-statistics/
Placement Statistics,"Placements Statistics 2023-2024, Download ; Placements Statistics 2022-2023, Download ; Placements Statistics 2021-2022, Download ; Placements Statistics 2019-2020 ...",https://www.nitnagaland.ac.in/index.php/placement-statistics
Placement Statistics - Centre For Career Development,Placement Statistics 2024 Detailed Report 1080 + Placements 208 + Companies Visited 187 + Internships 51 LPA Highest Package,https://www.placement.nitc.ac.in/placement
Placements | NIT Jamshedpur | राष्ट्रीय प्रौद्योगिकी संस्थान ...,"The Training & Placement Cell, NIT Jamshedpur, facilitates the process of placement of students passing out from the institute, besides collaborating with ...",https://www.nitjsr.ac.in/Students/Placements
Placement,"Campus Recruitment. Campus recruitment is a strategy for sourcing, engaging and hiring young talent for internship and entry-level positions.",https://www.nit.ac.in/placement.php
NIT Placements – Know Highest Salary Package & ...,"21 Jan 2025 — The average package of students in top NITs in India usually ranges from Rs 10-15 lakh per annum whereas, for other NITs, it is between Rs 5-10 lakh per annum.",https://www.shiksha.com/engineering/articles/nit-placements-know-highest-salary-package-placement-process-blogId-32207
