Heading,Snippet,Link
28 Digital Initiative of Government of India in Higher ...,"30 Mar 2019 — The 28 Digital Initiative of the Government of India in Higher Education aims to enhance learning through technology, promoting digital platforms, e-resources, ...",https://lisportal.com/digital-initiative-of-govt-of-india-in-higher-education/
Other Projects - NeGD - National e-Governance Division,Other Projects · MeriPehchaan · API Setu : Open API Platform · India Stack Global · National AI Portal (INDIAai) · Poshan Tracker · User Experience for Government ...,https://negd.gov.in/other-projects/
Schemes / Programmes / Missions / Applications,The PM-Kisan Samman Nidhi (Pradhan Mantri Kisan Samman Nidhi) is a Central Sector scheme by the Government of India. It provides financial assistance to ...,https://igod.gov.in/organization/b9e83XQBYNG-XPnvjOsx/SPMA/list
Digital India,Digital India flagship initiative launched by the Government of India to provide government services electronically to citizens through improved online ...,https://en.wikipedia.org/wiki/Digital_India
DigiLocker:An Initiative Towards Paperless Governance,Government & Public Sector · Skill ... DigiLocker is a flagship initiative of Ministry of Electronics & IT (MeitY) under Digital India programme.,https://www.digilocker.gov.in/
Government Initiatives in India: Tackling Cybersecurity ...,"Cyber Surakshit Bharat: To enhance the government's vision of ""Digital India,"" the Cyber Surakshit Bharat was launched by the Ministry of Electronics and ...",https://ccoe.dsci.in/blog/the-role-of-government-initiatives-in-tackling-cybersecurity-challenges-in-india
Ministry of Commerce and Industry,Government of India. Ministry of Commerce and Industry. DEPARTMENT OF COMMERCE · India - UK Comprehensive Economic and Trade Agreement (CETA).,https://www.commerce.gov.in/
India's Technological Revolution: Government Initiatives ...,"10 Feb 2025 — The Indian government has been actively promoting technology across various sectors to drive progress, enhance governance, and create employment opportunities.",https://uppcsmagazine.com/why-the-indian-government-is-promoting-technologies/
Nine Years of Digital India Initiative,4 Jul 2024 — Information Technology (IT) for Jobs: Enhance youth IT skills to meet growing industry demands through programs like Digital Literacy Mission ...,https://www.drishtiias.com/daily-updates/daily-news-analysis/nine-years-of-digital-india-initiative
Empowering youth with world-class education is key ...,"The scheme bridges the gap between learning and industry needs through updated curriculum, global skills, and enhanced internship opportunities.",https://www.facebook.com/MyGovIndia/posts/empowering-youth-with-world-class-education-is-key-to-building-an-aatmanirbharbh/1218324386995624/
List of initiatives where the Government is providing Online ...,Common Services Centers (CSC) 2.0: The CSC aims for establishing at least one CSC in each of 2.5 lakh Gram Panchayat (GP) level under Digital ...,https://www.reddit.com/r/india/comments/503l18/list_of_initiatives_where_the_government_is/
How Government-Led Digital Infrastructure Initiatives ...,21 Aug 2025 — Discover how government digital infrastructure initiatives like BharatNet and UPI are fueling enterprise tech adoption in India.,https://www.airtel.in/b2b/insights/blogs/5-ways-government-digital-infrastructure-initiatives-are-supercharging-enterprise-tech-adoption-in-india/
"Home | Ministry of Ayush, Govt. of India",Central Sector Scheme for Promotion of International Co-operation (IC) in Ayush. To promote and strengthen awareness and interest about Ayush Systems of ...,https://ayush.gov.in/
FACT SHEET: United States and India Elevate Strategic ...,1 Feb 2023 — President Biden and Prime Minister Modi announced the U.S.-India initiative on Critical and Emerging Technology (iCET) in May 2022 to elevate ...,https://in.usembassy.gov/fact-sheet-united-states-and-india-elevate-strategic-partnership-with-the-initiative-on-critical-and-emerging-technology-icet/
India's Digital Transformation: Government Services in ...,"23 Dec 2024 — According to NASSCOM, the Indian tech industry is projected to grow to $350 billion by 2025, further promoting digital initiatives that enhance ...",https://www.cdpp.co.in/articles/india-s-digital-transformation-government-services-in-2040-and-beyond
Home | Ministry of Tourism | Government of India,Awards are also given to the meritorious students of the institutes of Hotel Management and Indian Institute of Tourism & Travel Management. National ...,https://tourism.gov.in/
ADITI Details,"The ADITI Scheme leverages the existing iDEX Scheme to streamline the development process. ... Ministry of Commerce and Industry, Government of India. Any Indian ...",https://www.ddpmod.gov.in/offerings/schemes-and-services/aditi_details
Govt initiatives to promote Information Technology Industry ...,12 Feb 2022 — The Government of India (GoI) has taken various initiatives to promote Information Technology and Information Technology enabled Services (IT/ ITeS) sector in ...,https://taxguru.in/corporate-law/govt-initiatives-promote-information-technology-industry-services.html
"Digital India Scheme - Launch Date, Vision & Initiative List","The Digital India scheme is the government of India's flagship initiative, with the goal of transforming India into a digitally enabled society and knowledge ...",https://scripbox.com/saving-schemes/digital-india-scheme/
Digital India Stepping Stone for Govt Initiatives: Dr Andreas ...,"Some of the emerging areas that require attention in the capacity building programmes include Cloud-based solutions and procurement models for the same, mobile ...",https://egov.eletsonline.com/2015/11/digital-india-stepping-stone-for-govt-initiatives/
Projects & Initiatives - DST-Gujarat,Department for Science and Technology is responsible for formulation and implementation of key policies in this sector. Gujarat Informatics Ltd. has been ...,https://dst.gujarat.gov.in/Home/ProjectsandInitiatives
Home | Ministry of Health and Family Welfare | GOI,"MInistry of Health and Family Welfare is a Ministry under the Government of India and is charged with formulation, implementatio.",https://mohfw.gov.in/
Indian government E-learning initiatives in response to ...,"by M Singh · 2021 · Cited by 142 — SWAYAM, a major initiative of the Indian Government on E-learning was initiated to provide an integrated platform and portal for online courses ...",https://link.springer.com/article/10.1007/s10639-021-10585-1
initiatives for employment generation in it sector in,"Scheme. Subsequently, a request was received from the. BTC for increasing the assistance of Government of India for Textile Park to 90%. The M/o Textiles has ...",https://www.mha.gov.in/sites/default/files/nenl0707.pdf
"Make In India – Sectors, Scheme, Initiatives, Programs, ...","11 Jul 2024 — The Make in India initiative was launched in 25th September, 2014 to generate employment and business growth opportunities, with a major focus on Indian start- ...",https://razorpay.com/learn/make-in-india/
Home | Ministry of Youth Affairs and Sports | Government of India,Immense Pride as India's Young Boxers Shine at U-19 World Championships in Colorado (. 45th FIDE Chess Olympiad! Congrats to the Indian Men's Hockey Team ...,https://yas.gov.in/
what are various digital india initiatives taken by indian ...,15 Sept 2022 — Answer:Pradhan Mantri Kaushal Vikas Yojana (PMKVY) PAHAL (DBTL) Targeted Public Distribution System (TPDS) Visvesvaraya PhD Scheme For ...,https://brainly.in/question/53558059
Indian Space Research Organisation,"Indian Space Research Organisation (ISRO) is the space agency of India. The organisation is involved in science, engineering and technology to harvest the ...",https://www.isro.gov.in/
Digital Initiatives - Know Different Initiatives Taken by the GOI,Digital Initiatives Taken by Government of India to Improve Education! · National Mission on Education through Information and Communication Technology (NMEICT).,https://testbook.com/digital-electronics/digital-initiatives-by-government-of-india
Department of Government Projects (DGP),"Core Activities · Startup Village Entrepreneurship Programme [SVEP] Sponsored by Ministry of Rural Development, Government of India · National Rural Economic ...",https://ediindia.org/projects-government/
BIRAC-Home,"... (BIRAC) , a Public Sector Enterprise, set up by Department of Biotechnology (DBT), Government of India © 2025. Last Updated: 28 October, 2025. g20 · mygov.",https://www.birac.nic.in/
"Digital India Programme: About, Features, Significance & ...","5 Mar 2025 — Digital India is a flagship programme of the Government of India, launched on July 1, 2015, by Honourable Prime Minister Shri Narendra Modi",https://www.nextias.com/blog/digital-india-programme/
Schemes for MSMEs,"India initiatives. • 25% subsidy on ... Ministries/Departments of Government of India/State. Government, Industry Associations, Academic Institutions.",https://msme.gov.in/sites/default/files/Scheme-booklet-Eng.pdf
UX4G | User Experience Design for Government,"A National Workshop on UX and UI was held, bringing together stakeholders from government, industry and other relevant fields to explore the best UI/UX ...",https://www.ux4g.gov.in/
(PDF) Digital Initiatives of Government of India,"21 Sept 2023 — ... Education Sector – A Pandemic Perspective; At: Pollachi; Volume: Second. Authors: ... Nallamuthu Gounder Mahalingam College, Pollachi, Coimbatore, ...",https://www.researchgate.net/publication/374082815_Digital_Initiatives_of_Government_of_India
These 4 initiatives can make education more accessible in ...,"9 Oct 2022 — With conducive policies and initiatives of the Government of India, such as the National Education Policy (NEP) 2020 and over 5000 EdTech start- ...",https://theprint.in/india/education/these-4-initiatives-can-make-education-more-accessible-in-india-2/1160405/
Government Sponsored Schemes - NABARD,Off Farm Sector · Stand-Up India · Special Credit Linked Capital Subsidy Scheme (SCLCSS) ...,https://www.nabard.org/content1.aspx?id=23&catid=23&mid=530
Digital India Initiatives: Transforming Governance and ...,"Launched in 2015, this initiative wants to connect everyone online, from cities to villages. It's about making government services easy to access and boosting ...",https://sleepyclasses.com/digital-india-initiatives/
Artificial Intelligence (AI) - Government of India's initiatives ...,10 Jan 2024 — Artificial Intelligence (AI) - Government of India's initiatives in boosting skills and education to shape India's future workforce.,https://nationalskillsnetwork.in/artificial-intelligence-ai-government-of-indias-initiatives-in-boosting-skills-and-education/
Major Initiatives | Prime Minister of India,The aim is to de-license and de-regulate the industry during the entire life cycle of a business. ... Government of India. Shri Narendra Modi led a cleanliness ...,https://www.pmindia.gov.in/en/major-initiatives/
"How govt initiatives, affordable devices are helping fuel ...","20 May 2023 — One of the most prominent initiatives is the Digital India campaign, launched in 2015, which aims to transform India into a digitally empowered ...",https://yourstory.com/2023/05/india-digital-inclusion-government-initiatives-internet-connectivity
Best Practices | NFS,"Curated initiatives and case studies from across India and the world, to inspire learning, sharing, and adoption.",https://www.nitiforstates.gov.in/best-practice-landing
What Are The Key AI Initiatives Of Indian Government?,"21 May 2021 — In the last few years, the Indian government has launched several initiatives to boost AI, Big Data, virtual reality and robotics.",https://analyticsindiamag.com/ai-features/what-are-the-key-ai-initiatives-of-indian-government/
"National Institute for Micro, Small and Medium Enterprises (ni ...","ni-msme is an Organisation of Ministry of MSME, Govt. of India. It is a pioneer institute in the field of MSME and Entrepreneurship Development. The Institute ...",https://www.nimsme.gov.in/
Schemes | Department of Personnel & Training,"9 Dec 2022 — The Central Sector Scheme, 'Training For All (TFA)' is being implemented by DoPT since 1992. Presently, the Scheme has 4 components.",https://dopt.gov.in/employees-corner/schemes
Home: Anusandhan National Research Foundation ...,"This Program aims to impart high-end research training in frontier areas of Science and Technology, which are of interest to India.",https://serb.gov.in/
"List of Government Schemes in India, Objectives, Impacts",Important Government Schemes List for UPSC ; One District One Product Scheme. 2018. Ministry of Commerce & Industry ; PRARAMBH: Startup India International Summit.,https://vajiramandravi.com/current-affairs/important-government-schemes/
APIs,"A Digital India Initiative; Choose your theme. Select blue-themeSelect yellow ... Icon Sector Sector. All. API Hits. 2,134. Updated on. 22/08/2025. Created on.",https://www.data.gov.in/apis
Schemes / Programmes / Missions / Applications,Schemes / Programmes / Missions / Applications · AICTE Student Learning Assessment Project · All India Survey on Higher Education · Centralized Counseling for M.,https://igod.gov.in/organization/T9e83XQBYNG-XPnvjOsx/SPMA/list
Home - Small Industries Development Bank of India,"Small Industries Development Bank of India is the principal financial institution focused on promoting, financing, and developing the MSME sector in India.",https://www.sidbi.in/en/
National Skill Development Corporation (NSDC),WHAT WE DO · Ministry of Skill Development And Entrepreneurship · Skill India · Candidate registration for International Mobility · ASEEM · NSDC's Skills ...,https://nsdcindia.org/
Foreign Trade Policy,"This website belongs to Directorate General of Foreign Trade, Ministry of Commerce and Industry, Government of India. Browser and Display Compatibility. DGFT ...",https://www.dgft.gov.in/CP/?opt=ft-policy
About SHRESHTA | Scheme for Residential Education ...,To enhance the reach of the development initiative of the government. To fill the gap in service-deprived Scheduled Castes (SCs) dominant areas in the sector of ...,https://shreshta.admissions.nic.in/about-shreshta/
Digital MSME Scheme,"भारत सरकारGOVERNMENT OF INDIA · सूक्ष्म , लघु और ... Contact of Field Offices · Former Development Commissioners(MSME) · Organisation ...",https://dcmsme.gov.in/CLCS_TUS_Scheme/Digital_MSME_Scheme/Scheme_Guidelines.aspx
Ministry of Heavy Industries: Home,"Schemes · In a significant move aimed at revolutionizing the electric vehicle (EV) landscape in India, Government of India has approved the Scheme to Promote ...",https://heavyindustries.gov.in/
Government Goldmines for B.Tech CSE Students,The Skill India Mission is a flagship initiative by the Government of India aiming to train over 400 million people. Through NSDC-approved ...,https://www.linkedin.com/pulse/government-goldmines-btech-cse-students-manish-keshri-jaemc
government of india,13 Dec 2023 — (a) the details of the Skill India Digital (SID) initiative and its objectives launched by the Ministry; ... Indian workforce for Industry ...,https://sansad.in/getFile/annex/262/AU1231.pdf?source=pqars
DHR || ePMS,Government of India; स्वास्थ्य और परिवार कल्याण ... Department of Health Research (DHR) provides financial assistance to promote research in the field ...,https://schemes.dhr.gov.in/
Swayam Central,"From here, I learned how statistics are used as catalysts in the medical field. ... Initiative by : Ministry of Education (Govt of India). SWAYAM SUPPORT. Please ...",https://swayam.gov.in/
Services Schemes | Welfare of SC/ST/OBC,"WELFARE SCHEMES :- (A) Government of Delhi. The plan schemes included under the sector ""Welfare of SC/ST/OBC"" are being implemented by Departments of ...",https://scstwelfare.delhi.gov.in/scstwelfare/services-schemes
Govt launches 22 new schemes under Digital India ...,"29 Dec 2015 — The 22 initiatives launched under the Digital India programme include projects in the areas of digital infrastructure, digital empowerment, on- ...",https://www.livemint.com/Home-Page/QgFspv8UzykQP99AukcSjI/Govt-launches-22-new-schemes-under-Digital-India-programme.html
Important Schemes - Chief Minister's Office,The main aim of launching this scheme is to encourage students to crack the JEE or IIT or WBJEE or any other government services. With the help of quality ...,https://cm.wb.gov.in/ncmo/Public/Scheme_Master.aspx
Home | eAnudaan,"Government of India, Ministry of Social Justice & Empowerment ... Scheme for Residential Education for Students in High Schools in Targeted Areas (SHRESHTA)",https://grants-msje.gov.in/
Initiatives Taken by Indian Government for Cyber Security,Initiatives taken by The Indian Government on Cyber Security · 1. The Indian Computer Emergency Response Team (CERT-In) · 2. Cyber Surakshit Bharat · 3. National ...,https://unacademy.com/content/upsc/study-material/science-and-technology/initiatives-taken-by-indian-government-for-cyber-security/
Prime Minister's Employment Generation Program (PMEGP),"PMEGP is a central sector scheme administered by the Ministry of Micro, Small and ... scheme of Government of India or State Government are not eligible.",https://www.jansamarth.in/prime-minister-employment-generation-program-scheme
India's eGovernance Initiatives: Transforming Governance in ...,"18 Oct 2023 — The creation of a digital infrastructure that is both secure and stable, the digital delivery of government services, and achieving universal ...",https://egov.eletsonline.com/2023/10/indias-egovernance-initiatives-transforming-governance-in-the-digital-age/
"Ministry of Micro, Small & Medium Enterprises","Ministry of Micro, Small & Medium Enterprises (M/o MSME) envision a vibrant MSME sector ... GOVERNMENT OF INDIA. Skip to main content; Site Search. Search.",https://msme.gov.in/
FutureSkills Prime,"A digital skilling initiative by nasscom & MeitY, aimed at making India a Digital Talent Nation ... Industry aligned & Government backed. Endorse learners skills ...",https://www.futureskillsprime.in/
DOIT&C,"... students from different streams of Government Polytechnic College, DCM Road, Kota. ... Initiatives). Sponsored by. Department of Administrative Reforms and ...",https://doitc.rajasthan.gov.in/
Digital Initiatives,"SWAYAM is a programme initiated by Government of India and designed to achieve the three cardinal principles of Education Policy viz., access, equity and ...",https://www.citchennai.edu.in/digital-initiatives/
Startup Assam – an Initiative of Government of Assam,INVESTORS; Corporate Partners; iNCUBATORS & Academia. National. Confedration of Indian Industry. Indian chamber of commerce. NASSCOM. NVCL. STPI. International ...,https://startup.assam.gov.in/
Artificial Intelligence,"Government of Telangana has co-designed the AI framework document with the help of pioneers of industry, academia, start-ups, and policy advisors to provide a ...",https://it.telangana.gov.in/initiatives/artificial-intelligence/
Best Government Schemes for Students in India,"21 Apr 2025 — The various government schemes for students by the Indian government include the Bihar Free Laptop Yojana, Prerana Scheme for SC/ST Students, ...",https://fi.money/guides/investments/best-schemes-for-students-in-india
Punjab launches 'The English Edge' initiative,"6 hours ago — The intent was to empower students in government schools with world-class English communication skills, Punjab Education Minister Harjot Singh ...",https://www.thehindu.com/education/punjab-launches-the-english-edge-initiative/article70221087.ece
Home | BOARD OF PRACTICAL TRAINING,"Board of Practical Training, Eastern Region, is an autonomous body under the Ministry of Education, Govt. of India and has played a crucial role in ...",https://www.bopter.gov.in/
Initiatives - Additional Skill Acquisition Programme ...,An initiative to encourage industry dynamics and business innovation among students through a realistic model of industry on campus. The facilitators are ASAP ...,https://asapkerala.gov.in/initiatives/
DoS/ISRO INTERNSHIP & STUDENT PROJECT TRAINEE ...,23 Jan 2025 — DoS/ISRO INTERNSHIP & STUDENT PROJECT TRAINEE SCHEMEs Home / DoS/ISRO INTERNSHIP & STUDENT PROJECT TRAINEE SCHEMEs ... Government of India logo ...,https://www.isro.gov.in/InternshipAndProjects.html
MHRD - Digital Initiatives in Higher Education,E-Yantra enable the effective education across engineering colleges in India on embedded systems and Robotics. The training for teachers and students is ...,https://www.gnauniversity.edu.in/mhrd
DIGITAL EMPOWERMENT | Tamil Nadu Information ...,"Digital India vision promises to transform India into a fully connected knowledge economy, offering world class services at the click of a mouse. This vision ...",https://it.tn.gov.in/en/Digital_Empowerment
Internship Program | Free & Paid Internships for Students ...,"... fields who aspire to establish a successful career in medical writing. ... Ministry of Skill Development and Entrepreneurship, Government of India. Last ...",https://www.skillindiadigital.gov.in/internship
Emerging Technologies,"The government has created a vertical for emerging technologies and the objective is two-fold, one is to develop the ecosystem required for the industry and the ...",https://it.telangana.gov.in/initiatives/emerging-technologies/
Government's Digital Initiatives,The Indian government started an e-administration known as ePanchayat to streamline and improve inward government activities to improve governance quality · The ...,https://unacademy.com/content/upsc/study-material/science-and-technology/governments-digital-initiatives/
"Ashwini Vaishnaw: Govt To Upskill Rural India In AI, ML & ...","Ashwini Vaishnaw: Govt To Upskill Rural India In AI, ML & Cybersecurity | Business News | ET Now AI Training Boost for Rural India!",https://www.youtube.com/watch?v=tzNDtYfj8dU
