Heading,Snippet,Link
About Us - Digital India | Leading the transformation in ...,"Digital India, launched in 2015, aims to transform India into a digitally empowered society, improving lives through digital services and expanding the digital ...",https://www.digitalindia.gov.in/about-us/
Major IT Initiatives,The Digital India Programme is a flagship Programme of the Government of India with a vision to transform India into a digitally empowered society and knowledge ...,https://haryanait.gov.in/major-it-initiatives/
Government Initiatives,"6 days ago — Government initiatives include tax exemptions, legal support, easy compliance, relaxed procurement, a fund of funds, credit guarantee, and ...",https://www.startupindia.gov.in/content/sih/en/international/go-to-market-guide/government-initiatives.html
Students Development schemes | All India Council for ...,AICTE-CII India Innovation Initiative Towards bridging gap between academia and industry · Startup Contest Promoting student driven innovations & start-ups.,https://aicte.gov.in/schemes/students-development-schemes
About the Scheme | Government of India,"8 May 2025 — FutureSkills PRIME is an industry-aligned skilling initiative sponsored by the Ministry of Electronics and Information Technology (MeitY), ...",https://www.nielit.gov.in/content/about-scheme-0
Top 5 Digital Education Initiatives by Government of India I 2025,12 Apr 2025 — 1. PM e-VIDYA · 2. ePathshala · 3. DIKSHA (Digital Infrastructure for Knowledge Sharing) · 4. NISHTHA (National Initiative for School Heads' and ...,https://www.apnipathshala.org/top-5-digital-education-initiatives-by-government-of-india-i-2025/
IT Industry and Digital India Initiatives in India,"The government's Digital India initiatives aim to bridge the digital divide, promote e-governance, and empower citizens through improved digital infrastructure ...",https://rajras.in/ras/mains/paper-2/science/it-industry-and-digital-india-initiatives-in-india/
Digital India Internship Scheme,"The Ministry of Electronics and Information Technology (MeitY) has introduced an internship scheme named ""Digital India Internship Scheme.",https://www.myscheme.gov.in/schemes/mdiis
Ministry of Electronics and Information Technology: Home,"MeitY's focus areas include the development, promotion, and regulation of the electronics and IT industry in India, fostering digital governance.",https://meity.gov.in/
Government of India Expands AI-Driven Skilling,"19 Mar 2025 — MeitY through IndiaAIFutureSkills Pillar aims to increase the number of graduates, postgraduates, and PhD scholars in the AI domain while ...",https://www.pib.gov.in/PressReleasePage.aspx?PRID=2113095
Role Of Government Initiatives In Digital Education In India,"The Indian government promotes digital education through initiatives like SWAYAM, DIKSHA, e-Pathshala, and PM eVIDYA, under the Digital India mission.",https://www.vidyalaya.org.in/digital-education-in-india/
"Digital India | Objectives, Key Initiatives & Progress","In July 2015, the Indian government launched the 'Digital India' initiative to improve online infrastructure and increase internet accessibility among ...",https://ibef.org/government-schemes/digital-india
Five ambitious AI initiatives by Indian Government to foster. ...,"Equipped with the best IT talent capital, India has also started many ambitious initiatives to transform AI into a digital tool for national development with a ...",https://indiaai.gov.in/article/five-ambitious-ai-initiatives-by-indian-government-to-foster-national-growth
Website of Viksit Bharat Initiative for Student Innovation ...,"27 Nov 2024 — Viksit Bharat Initiative for Student Innovation and Outreach Network (VISION), aimed at nurturing education, skill development, ...",https://www.india.gov.in/website-viksit-bharat-initiative-student-innovation-and-outreach-network-vision
"India Science, Technology & Innovation - ISTI Portal: Home",ANRF- Prime Minister Professorship Program (Last Date to Apply: 1 Sept. · INSPIRE-MANAK Call for Nominations for Students' Technological Ideas/Innovations (Last ...,https://www.indiascienceandtechnology.gov.in/
Government Incentives Program | Upskilling,"The program offers up to ₹12,000 for digital upskilling, including course fees, certifications, internships, and assessment fee reimbursements. Claim after ...",https://www.futureskillsprime.in/govt-of-india-incentives/
"Programmes, Policies, and Initiatives related to ICT - UPSC",11 Feb 2021 — Digital India Initiative. Digital India was an initiative taken by the Government of India for providing high-speed internet networks to rural ...,https://lotusarise.com/programmes-policies-and-initiatives-related-to-ict-upsc/
10 initiatives for Digital India,1. Formation of e-inclusion. 2. increase services through mobile technology. 3. Enhancing ICT skills. 4. Use of ICT in Export and import services. 5. Use of ...,https://www.mygov.in/task/10-initiatives-digital-india/?page=0%2C13
Schemes and Services of Ministry of Electronics and ...,"24 Feb 2025 — Information about GI Cloud and State Data Centre Scheme, Financial Reports by Ministry of Electronics and Information Technology",https://www.india.gov.in/schemes-and-services-ministry-electronics-and-information-technology
Digital India initiative of Government has revolutionized ...,2 Aug 2023 — Government of India launched the 'Digital India' programme with the vision to transform India into a digitally empowered society and knowledge-based economy.,https://www.pib.gov.in/Pressreleaseshare.aspx?PRID=1945057
AICTE FLAGSHIP SCHEMES AND INITIATIVES,"6 Jul 2025 — AICTE initiatives include NEP implementation, skill programs, space tech, Generation Green, drone labs, AI centers, IDEA Labs, AURA, VAANI, and ...",https://aicte.gov.in/downloads/initiatives/AICTE-VISION-MERGED.pdf
Government initiatives for Digital Education in India,"1 Oct 2022 — PM E-Vidhya: It is a comprehensive program announced on 17 May 2020, with the objective to unify digital and online education with the education ...",https://timesofindia.indiatimes.com/education/online-schooling/government-initiatives-for-digital-education-in-india/articleshow/94532897.cms
Indian Government Initiatives in Game Design and ...,29 May 2025 — The Indian government is investing in integrating gaming technology and design into governance. They understand it helps to enhance citizen ...,https://strate.in/indian-government-initiatives-in-game-design-and-development/
Programmes of Government of India,"The Indian government has various employment schemes, including Atmanirbhar Bharat Rojgar Yojana, Pradhan Mantri Rojgar Protsahan Yojana, and Mahatma Gandhi ...",https://dge.gov.in/dge/schemes_programmes
Initiatives Taken by Indian Government for Online Education,"15 Jan 2024 — The Indian government's initiatives include PM eVidya, DIKSHA, ePathshala, Digital Saksharta Abhiyan, and Startup India, focused on ...",https://www.learningroutes.in/blog/government-initiatives-for-online-education
Digital India Mission,Digital India was an initiative taken by the Government of India for providing high-speed internet networks to rural areas. Digital India Mission was launched ...,https://byjus.com/free-ias-prep/digital-india/
Government Schemes for Startups,"6 days ago — The government provides schemes for startups in sectors like technology, manufacturing, agriculture, and healthcare, offering financial, ...",https://www.startupindia.gov.in/content/sih/en/government-schemes.html
"Skill India Digital Hub (SIDH) - Upskilling, reskilling, career ...","Explore Skill India Digital Hub's (SIDH) free courses & skill development schemes across sectors including IT, digital marketing, coding, AI.",https://www.skillindiadigital.gov.in/
The Role of Government Initiatives in Boosting Startups,26 Mar 2024 — The Startup India Initiative and the Atal Innovation Mission are pioneering initiatives that are driving India's success in the global startup ...,https://www.investindia.gov.in/blogs/role-government-initiatives-boosting-startups
Schemes/ Programmes,"1 Sept 2023 — Wide range of schemes/ programmes covering human and institutional capacity building, research and development, technology development, innovation & ...",https://dst.gov.in/schemes-programmes
IT & ITES - Invest UP - Government of Uttar Pradesh,"3 Oct 2024 — The IT sector has been contributing immensely to the state economy with the presence of companies such as Microsoft, TCS, PayTM, HCL, Wipro, MAQ, Adobe, ...",https://invest.up.gov.in/it-ites/
GOVERNMENT OF INDIA'S INITIATIVES TO ...,"10 Mar 2025 — GOVERNMENT OF INDIA'S INITIATIVES TO REVOLUTIONIZE EDUCATION SECTOR · Introduces a credit-based education system where students can earn, store, ...",https://investpunjabblog.com/2025/03/10/government-of-indias-initiatives-to-revolutionize-education-sector/
(PDF) AI INITIATIVES BY INDIAN GOVERNMENT,"Abstract ; The portal has different sections named: News, Articles, Ecosystem, Resources, Skills and Job, Sectors, Govt. of ; India and Initiatives and ...",https://www.researchgate.net/publication/344270789_AI_INITIATIVES_BY_INDIAN_GOVERNMENT_JOURNEY_TOWARDS_BECOMING_GLOBAL_TECHNOLOGY_LEADER
Govt launches SOAR initiative to equip school students ...,"23 Jul 2025 — The Indian government has rolled out the SOAR (Skilling for AI Readiness) programme, marking a significant step towards integrating ...",https://timesofindia.indiatimes.com/education/news/govt-launches-soar-initiative-to-equip-school-students-with-ai-skills-featuring-15-hour-modules-for-grades-6-12-check-all-details-here/articleshow/122854935.cms
Digital India Future Labs Initiative by the Government of India,It will bring new career opportunities to grow within Indian ecosystem. The collaborative industry partners and start-ups will seek new employees to work in the ...,https://hetic.in/digital-india-future-labs-by-government/
Indian Government Initiatives to Upskill the Nation and its ...,"This provides training which covers various fields such as Soft skills, Digital literacy, and Entrepreneurship, aligning with the National Skills Qualification ...",https://pifinity.org/indian-government-initiatives-to-upskill-the-nation-and-its-youth/
Schemes/ Programmes,1 Sept 2023 — भारत सरकारGOVERNMENT OF INDIA; विज्ञान और ... students & research scholars towards promoting research and innovation activities in the country.,https://dst.gov.in/schemes-programmes
Q 1.What are some of the digital initiatives undertaken by ...,The government of India has launched several initiatives to promote digital education.Some of them are: i)Operation Digital Board ...,https://www.quora.com/Q-1-What-are-some-of-the-digital-initiatives-undertaken-by-the-govt-of-India-to-promote-education
Digital Education Initiatives,12 Aug 2021 — The government introduced the PM eVIDYA programme in May 2020 to make e-learning more accessible for Indian students and teachers and promote & ...,https://ibef.org/blogs/digital-education-initiatives
"NITI AAYOG, India","NITI Aayog is the premier policy think tank of the Government of India, providing directional and strategic inputs on development, innovation, and inclusive ...",https://niti.gov.in/
NeGD - National e-Governance Division | Digital India ...,"Official portal of NeGD (National e-Governance Division), driving Digital India with citizen-centric e-Governance, digital platforms, and ICT innovations.",https://negd.gov.in/
Which government initiative in India primarily focuses on ...,"25 Jun 2024 — This initiative was introduced by the Ministry of Education, Government of India, to develop a digital infrastructure for education. NDEAR aims ...",https://testbook.com/question-answer/which-government-initiative-in-india-primarily-foc--66693cee231aaf147211da8e
Government Initiatives for Enhancing Access to Academic ...,"27 Dec 2023 — NIELIT provides education and training in the field of electronics, information technology, and related sectors. It offers both online and ...",https://teachers.institute/educational-technology-overview/government-initiatives-academic-resources-india/
ICT Technology: Its Role and Impact at WIC,"24 Nov 2023 — Shedding Light on the Winning Transformative Government Initiatives to accelerate ICT · The Digital India Program, launched in 2015, marked a ...",https://www.investindia.gov.in/blogs/ict-technology-its-role-and-impact-wic
List of Government Schemes for Students in India,17 Jul 2025 — 5 Government Schemes for Students in India · PM Scholarship Scheme (PMSS) · PM Kaushal Vikas Yojana (PMKVY) · PM CARES for Children · Atal ...,https://www.bajajbroking.in/blog/government-schemes-for-students-in-india
Revolutionizing Higher Education: Role of Digital Initiatives ...,"Through collaboration, adaptation, and a commitment to excellence, India's higher education sector is poised for a dynamic and transformative journey in the ...",https://icert.org.in/index.php/edu-mania/edumania-vol-2-issue-1/revolutionizing-higher-education-role-of-digital-initiatives-in-india-for-tackling-challenges-with-innovation-and-technology/
New Initiatives for Education Sector,"30 Jul 2021 — NISHTHA is the largest teachers' training programme, first of its kind in the world to motivate and equip teachers to encourage and foster ...",https://www.drishtiias.com/daily-news-analysis/new-initiatives-for-education-sector
"As an IT sector employee, what has the current Indian ...","As an IT sector employee, what has the current Indian government done for me? Which are the popular schemes launched for IT sector employees?",https://www.quora.com/As-an-IT-sector-employee-what-has-the-current-Indian-government-done-for-me-Which-are-the-popular-schemes-launched-for-IT-sector-employees
Initiatives by the government to strengthen skill based ...,30 Jul 2022 — Initiatives by the government under the name of the Skill India Mission (SIM) to strengthen skill based education in India under NEP 2020.,https://nationalskillsnetwork.in/initiatives-by-the-government-to-strengthen-skill-based-education-under-nep-2020/
List of schemes of the government of India,"Schemes that the central government fully funds are referred to as ""central sector schemes"" (CS). In contrast, schemes mainly funded by the center and ...",https://en.wikipedia.org/wiki/List_of_schemes_of_the_government_of_India
Govt initiating programmes under Digital India for IT sector ...,"3 Jan 2018 — IT Minister Ravi Shankar Prasad said the measures under the Digital India initiative include steps to increase domestic electronic production, ...",https://www.business-standard.com/article/economy-policy/govt-initiating-programmes-under-digital-india-for-it-sector-growth-prasad-118010300488_1.html
DPIIT Internship Scheme,The objective behind the internship scheme is to give exposure to the students to understand the working culture of Govt. of India and exposure to the schemes ...,https://www.myscheme.gov.in/schemes/dpiit-is
Leveraging language technology for national good,13 Jan 2021 — The public sector in India is proactively using NLP ... Leveraging language technology for national good: Initiatives by the Indian govt.,https://indiaai.gov.in/article/leveraging-language-technology-for-national-good-initiatives-by-the-indian-govt
Research Grants,"Objectives : Government-Industry collaboration for transforming research mind-set and culture in India to foster novel, transformative and impactful research ...",https://serb.gov.in/page/english/research_grants
Initiatives taken by the Ministry of Education - Vikaspedia,"SWAYAM is a programme initiated by Government of India and designed to achieve the three cardinal principles of Education Policy viz., access, equity and ...",https://education.vikaspedia.in/viewcontent/education/policies-and-schemes/initiatives-taken-by-the-ministry-of-education?lgn=en
r/india - Major Government Initiatives Launched To Benefit ...,r/india - Major Government Initiatives Launched To Benefit Students In The Education Sector. ndtv.com. Open. Upvote 5. Downvote 2 Go to ...,https://www.reddit.com/r/india/comments/1ho629j/major_government_initiatives_launched_to_benefit/
List of Government Schemes in India,Atmanirbhar Bharat Abhiyan · Mission Karmayogi · Pradhan Mantri SVANidhi Scheme · Samarth Scheme · Savya Shiksha Abhiyaan · Rashtriya Gokul Mission · Production ...,https://byjus.com/govt-exams/government-schemes/
Advancing Technology and Innovation,"Technology Development Board, New Delhi (TDB) provides financial assistance to Indian industrial concerns and other agencies, attempting development and ...",https://tdb.gov.in/advancing-technology-and-innovation
National Informatics Centre - Homepage | India,National Informatics Centre (NIC) under the Ministry of Electronics and Information Technology (MeitY) is the technology partner of the Government of India.,https://www.nic.gov.in/
Digital India Corporation: Driving India's Digital Transformation,Digital India Corporation (DIC) is a non-profit organization to empower India through digital innovation & technology-driven solutions.,https://dic.gov.in/
10 Free Education Government Schemes in India,5 Aug 2024 — 10 Government Schemes For Free Education in India · Sarva Shiksha Abhiyan (SSA) · Right to Education (RTE) Act · National Programme for Education ...,https://www.cry.org/blog/government-schemes-for-free-education-in-india/
Contemporary Government Initiatives for Youth Upliftment,PM Vidyalaxmi enhances existing education support schemes and aims to ensure broader access to higher education across India. Skill Development and Training.,https://afpr.in/contemporary-government-initiatives-for-youth-upliftment/
MyGov.in | MyGov: A Platform for Citizen Engagement towards ...,MyGov is an innovative platform to build a partnership between Citizens and Government with the help of technology for growth and development of India.,https://mygov.in/
Schemes | Department of Social Justice and Empowerment,"4 days ago — Educational Schemes. #, Scheme Name, Website URL. 1, Central Sector Scholarship of Top Class Education for SC Students · https://scholarships.",https://socialjustice.gov.in/schemes
How Digital India initiative can revive the education sector,24 Dec 2014 — Indian government's ambitious National Optical Fibre Network (NOFN) is going to be backbone of the Digital India campaign. Expansion of ...,https://www.digit.in/features/telecom/how-digital-india-initiative-can-revive-the-education-sector-24721.html
Make In India,"Explore India's vibrant Startup Ecosystem: From the Startup India initiative's impact to government support, discover the thriving landscape.",http://www.makeinindia.com/
Google to work with Indian Govt. on digital literacy & other ...,10 Oct 2014 — “The Digital India Program has been launched with the vision of transforming India into a digitally empowered society and knowledge economy. It ...,https://www.dsim.in/blog/google-to-work-with-indian-govt-on-digital-literacy-other-programs/
Welcome to Department of Biotechnology | Department of ...,"The Department of Biotechnology (@DBTIndia) advances healthcare, agriculture, and environmental sustainability under India's Ministry of Science ...",https://dbtindia.gov.in/
which of these is an initiative of the government to promote ...,9 Sept 2023 — Digital India is a campaign launched by the Government of India to ensure that the Government's services are made available to citizens electronically.,https://brainly.in/question/57929646
Ministry of Statistics and Program Implementation ...,"Ministry of Statistics and Programme Implementation, Government of India.",https://www.mospi.gov.in/
Employment Schemes,Eligibility. Should be an Indian Citizen; 12th class dropouts or 10th pass students can enroll in PMKVY to develop their skill set. · Benefits. Create an ...,https://eshram.gov.in/employment-schemes
"ICT Initiatives of MHRD, Government of India",3. e-Pathya is one the verticals of e-PG Pathshala which is software driven course / content package that facilitates students pursuing higher education (PG ...,https://vnit.ac.in/wp-content/uploads/2020/02/ICT-Initiatives-of-MHRD-Government-of-India.pdf
"C-DAC: Centre for Development of Advanced Computing, India","... Ministry of Communications and Information Technology, Government of India. C-DAC, is primarily an R and D institution involved in the design, development ...",https://www.cdac.in/
"Official Website of Invest UP, Government of Uttar Pradesh, India",The Government of India has identified the Defence and Aerospace sector ... The Tourism and Hospitality sector is an integral part of the Make in India initiative ...,https://invest.up.gov.in/
State Schemes,"Benefit: Scholarship of Upto 50,000 Rs which will cover exam fees and college admission fees. ... Eligbility: Family Income less than 3 Lakh Rs. For Students of ...",https://dwbdnc.dosje.gov.in/state
Digital Initiatives in Higher Education by MHRD,"A programme initiated by Government of India, designed to achieve the three ... Curriculum based courses that can meet the needs of lifelong learners of. Indian ...",https://gndec.ac.in/sites/default/files/Digital%20ICT%20Initiatives_MHRD.pdf
Make In India | Prime Minister of India,Innovation and research activities are supported through fast paced registration system and accordingly infrastructure of Intellectual Property Rights ...,https://www.pmindia.gov.in/en/major_initiatives/make-in-india/
Digital Initiative,"With technology and internet access, the Government of India has launched various digital initiatives in higher education to improve the quality of higher ...",https://www.asmie.in/digital_initiative.php
Untitled,/en/schemes-initiatives.,https://msde.gov.in/en/schemes-initiatives
"What is Digital India? Initiatives, Objectives, and Benefits","Digital India has synergized with government schemes like Make in India, Startup India, and Atmanirbhar Bharat, boosting the economy and positioning India ...",https://www.businessgo.hsbc.com/en/article/what-is-digital-india-initiatives-objectives-and-benefits
Home | Ministry of Food Processing Industries | Government of ...,"MOFPI, FPI,Ministry of Food Processing Industries, Mega Food Parks,National Mission on Food Processing,Cold Chain,IGPB,IICPT.",https://www.mofpi.gov.in/
Information and communication technology initiatives in India,The document discusses several initiatives by the Indian government to promote education ... field of knowledge with those of the other. It also galvanises ...,https://www.slideshare.net/slideshow/information-and-communication-technology-initiatives-in-india/252191104
ICT initiatives in School Education of India,utilise these technologies in all fields of education. The vision ... emphasised in Government of India's latest flagship programme on education 'Samagra.,https://journals.ncert.gov.in/IJET/article/download/257/54/518
Ministry of Social Justice and Empowerment,news icon News / Events (What's New) · Major Schemes · Dr. Virendra Kumar · Shri Ramdas Athawale · Shri B. L. Verma · news icon Important Links ...,https://socialjustice.gov.in/
Strategies for Enhancing Digital Literacy in India,"18 Mar 2024 — Digital Saksharta Abhiyan (DISHA) : Under the DISHA initiative, the government partners with various stakeholders, including NGOs, academic ...",https://theunitedindian.com/news/Digital-literacy-in-India
India's Innovative STEM Programs for the Next Generation,"22 Aug 2024 — Google's Code to Learn initiative: To encourage students to think computationally, Google India has launched coding competitions and seminars.",https://indiastemfoundation.org/blog/stem-programs-next-generation/
About Software Technology Parks of India (STPI),"In order to achieve this, STPI has evolved a collaborative model wherein government, industry, academia, and other stakeholders are playing a vital role for ...",http://stpi.in/en/about-stpi
About Digital India,Digital India is a flagship programme of the Government of India with a vision to transform India into a digitally empowered society and knowledge economy. The ...,https://csc.gov.in/digitalIndia
Home | Department for Promotion of Industry and Internal Trade,We are committed to making India the most investment-friendly country in the world. Vibrant Gujarat Summit. 17.04.2015. open_in_newView Event ...,https://dpiit.gov.in/
Idex Details,"Startups, as defined and recognized by Department of Industrial Policy Promotion (DIPP), Ministry of Commerce and Industry, Government of India. Any Indian ...",https://www.ddpmod.gov.in/offerings/schemes-and-services/idex
ITEC :Indian Technical and Economic Cooperation,"The Indian Technical and Economic Cooperation Programme, ITEC for short, is the leading capacity building platform of the Ministry Of External Affairs, ...",https://www.itecgoi.in/
List of Cybersecurity Initiatives by the Government of India,10 Oct 2024 — Cyber security in India has seen the government put great effort into ensuring skills in the field and awareness across the population and ...,https://www.strongboxit.com/list-of-cybersecurity-initiatives-by-the-government-of-india/
Invest in IT/ITES Sector in India | IIG,"14 Oct 2025 — As India charts its path toward becoming a developed nation by 2047, the government actively supports this transformation. Initiatives such as ...",https://indiainvestmentgrid.gov.in/sectors/it-ites
10 Digital Initiatives In Higher Education - Gibbon by EduGorilla,7 Jun 2022 — The Government of India has taken various digital initiatives in higher education to promote access to higher education for all the country's ...,https://gibbon.edugorilla.com/blog/digital-initiatives-in-higher-education/
